Symbol,Name,Last Sale,Net Change,% Change,Market Cap,Country,IPO Year,Volume,Sector,Industry
DDL,Dingdong (Cayman) Limited American Depositary Shares (each two representing three Ordinary Shares),$1.79,0.01,0.562%,211423779.00,Cayman Islands,2021,436876,Consumer Discretionary,Catalog/Specialty Distribution
DDOG,Datadog Inc. Class A Common Stock,$112.28,-1.78,-1.561%,37557526611.00,United States,2019,4514495,Technology,Computer Software: Prepackaged Software
DDS,Dillard's Inc. Common Stock,$388.92,8.01,2.103%,6313602048.00,United States,,112702,Consumer Discretionary,Department/Specialty Retail Stores
DDT,Dillard's Capital Trust I,$25.7484,-0.0215,-0.083%,417991235.00,United States,,11287,Consumer Discretionary,Department/Specialty Retail Stores
DE,Deere & Company Common Stock,$346.03,-3.11,-0.891%,95355597138.00,United States,,1334045,Industrials,Industrial Machinery/Components
DEA,Easterly Government Properties Inc. Common Stock,$13.42,0.00,0.00%,1382724359.00,United States,2015,576407,Real Estate,Real Estate Investment Trusts
DEC,Diversified Energy Company plc Ordinary Shares,$13.77,-0.14,-1.006%,650359565.00,,,119374,,
DECA,Denali Capital Acquisition Corp. Class A Ordinary Shares,$11.45,0.00,0.00%,0.00,United States,2022,35273,Finance,Blank Checks
DECAW,Denali Capital Acquisition Corp. Warrant,$0.0431,0.008,22.792%,0.00,United States,2022,400,Finance,Blank Checks
DECK,Deckers Outdoor Corporation Common Stock,$890.25,6.32,0.715%,22621761723.00,United States,1993,215723,Consumer Discretionary,Shoe Manufacturing
DEI,Douglas Emmett Inc. Common Stock,$14.82,-0.44,-2.883%,2480552882.00,United States,2006,2689287,Real Estate,Real Estate Investment Trusts
DELL,Dell Technologies Inc. Class C Common Stock ,$92.55,1.09,1.192%,65646097509.00,United States,2018,8387186,Technology,Computer Manufacturing
DENN,Denny's Corporation Common Stock,$5.81,0.02,0.345%,298482760.00,United States,,935906,Consumer Discretionary,Restaurants
DEO,Diageo plc Common Stock,$124.55,1.71,1.392%,69223832321.00,United Kingdom,,903115,Consumer Staples,Beverages (Production/Distribution)
DERM,Journey Medical Corporation Common Stock,$4.98,0.02,0.403%,99664222.00,United States,2021,63212,Health Care,Biotechnology: Pharmaceutical Preparations
DESP,Despegar.com Corp. Ordinary Shares,$10.38,0.07,0.679%,747922689.00,Argentina,2017,725812,Consumer Discretionary,Transportation Services
DFH,Dream Finders Homes Inc. Class A Common Stock,$27.43,0.01,0.036%,2570962962.00,United States,2022,284097,Consumer Discretionary,Homebuilding
DFIN,Donnelley Financial Solutions Inc. Common Stock ,$63.06,0.46,0.735%,1830851186.00,United States,2016,106664,Consumer Discretionary,Other Consumer Services
DFLI,Dragonfly Energy Holdings Corp. Common Stock (NV),$0.6477,0.018,2.859%,39191988.00,United States,2021,133265,Miscellaneous,Industrial Machinery/Components
DFLIW,Dragonfly Energy Holdings Corp. Warrant,$0.0426,0.0026,6.50%,2577704.00,United States,2021,476,Miscellaneous,Industrial Machinery/Components
DFP,Flaherty & Crumrine Dynamic Preferred and Income Fund Inc. Common Stock,$19.41,-0.07,-0.359%,0.00,,2013,48644,Finance,Investment Managers
DFS,Discover Financial Services Common Stock,$126.39,1.29,1.031%,31732931941.00,United States,,630878,Finance,Finance: Consumer Services
DG,Dollar General Corporation Common Stock,$116.81,-1.36,-1.151%,25685894300.00,United States,2009,1520814,Consumer Discretionary,Department/Specialty Retail Stores
DGHI,Digihost Technology Inc. Common Subordinate Voting Shares,$1.105,-0.03,-2.643%,33150386.00,Canada,,25168,Finance,Finance: Consumer Services
DGICA,Donegal Group Inc. Class A Common Stock,$14.23,0.15,1.065%,476472340.00,United States,,25912,Finance,Property-Casualty Insurers
DGICB,Donegal Group Inc. Class B Common Stock,$11.88,0.00,0.00%,397785762.00,United States,1986,34,Finance,Property-Casualty Insurers
DGII,Digi International Inc. Common Stock,$27.22,-0.36,-1.305%,991221308.00,United States,1989,332994,Telecommunications,Computer Communications Equipment
DGLY,Digital Ally Inc. Common Stock,$1.01,-0.025,-2.415%,2908624.00,United States,,121232,Technology,Radio And Television Broadcasting And Communications Equipment
DGX,Quest Diagnostics Incorporated Common Stock,$149.31,-0.75,-0.50%,16620772326.00,United States,,675578,Health Care,Medical Specialities
DH,Definitive Healthcare Corp. Class A Common Stock,$3.89,0.06,1.567%,455608906.00,United States,2021,1083190,Technology,Computer Software: Prepackaged Software
DHAI,DIH Holdings US Inc. Class A Common Stock,$2.24,-0.01,-0.444%,90820654.00,United States,2024,4448,Health Care,Medical/Dental Instruments
DHAIW,DIH Holding US Inc. Warrants,$0.046,0.00,0.00%,1865067.00,United States,2024,15240,Health Care,Medical/Dental Instruments
DHC,Diversified Healthcare Trust Common Shares of Beneficial Interest,$3.13,0.02,0.643%,752998532.00,United States,,757967,Real Estate,Real Estate Investment Trusts
DHCNI,Diversified Healthcare Trust 5.625% Senior Notes due 2042,$13.94,0.04,0.288%,3353610077.00,United States,,32768,Real Estate,Real Estate Investment Trusts
DHCNL,Diversified Healthcare Trust 6.25% Senior Notes Due 2046,$15.105,-0.095,-0.625%,3633879499.00,United States,,55067,Real Estate,Real Estate Investment Trusts
DHF,BNY Mellon High Yield Strategies Fund Common Stock,$2.519,0.019,0.76%,0.00,United States,1998,129263,Finance,Finance Companies
DHI,D.R. Horton Inc. Common Stock,$172.97,0.24,0.139%,56395155405.00,United States,,2833870,Consumer Discretionary,Homebuilding
DHIL,Diamond Hill Investment Group Inc. Class A Common Stock,$150.18,-0.38,-0.252%,413148634.00,United States,,21998,Finance,Investment Managers
DHR,Danaher Corporation Common Stock,$268.11,-0.53,-0.197%,193632549147.00,United States,,2017765,Industrials,Industrial Machinery/Components
DHT,DHT Holdings Inc.,$10.92,-0.04,-0.365%,1758114999.00,Jersey,2005,1562341,Consumer Discretionary,Marine Transportation
DHX,DHI Group Inc. Common Stock,$2.06,-0.01,-0.483%,99711960.00,United States,2007,56601,Consumer Discretionary,Business Services
DHY,Credit Suisse High Yield Bond Fund Common Stock,$2.09,0.00,0.00%,0.00,United States,1998,1083814,Finance,Finance/Investors Services
DIAX,Nuveen Dow 30SM Dynamic Overwrite Fund Common Shares of Beneficial Interest,$14.06,0.09,0.644%,0.00,,2014,63504,Finance,Finance Companies
DIBS,1stdibs.com Inc. Common Stock,$4.01,-0.02,-0.496%,159169483.00,United States,2021,58468,Consumer Discretionary,Catalog/Specialty Distribution
DIN,Dine Brands Global Inc. Common Stock,$30.10,0.35,1.176%,460500352.00,United States,,669082,Consumer Discretionary,Restaurants
DINO,HF Sinclair Corporation Common Stock,$46.35,-0.29,-0.622%,8844354694.00,United States,1960,1597370,Energy,Natural Gas Distribution
DIOD,Diodes Incorporated Common Stock,$64.68,4.50,7.478%,2983229431.00,United States,,1238381,Technology,Semiconductors
DIS,Walt Disney Company (The) Common Stock,$86.21,0.25,0.291%,156349368030.00,United States,,15989279,Consumer Discretionary,Services-Misc. Amusement & Recreation
DIST,Distoken Acquisition Corporation Ordinary Shares,$10.83,0.00,0.00%,0.00,China,2023,5,Finance,Blank Checks
DISTW,Distoken Acquisition Corporation Warrant,$0.023,0.00,0.00%,0.00,China,2023,2,Finance,Blank Checks
DIT,AMCON Distributing Company Common Stock,$151.99,0.99,0.656%,95808720.00,United States,1999,144,Consumer Discretionary,Food Distributors
DJCO,Daily Journal Corp. (S.C.) Common Stock,$426.48,-6.02,-1.392%,587274048.00,United States,,38871,Consumer Discretionary,Newspapers/Magazines
DJT,Trump Media & Technology Group Corp. Common Stock,$26.21,-0.13,-0.494%,4631322280.00,United States,2024,1801585,Technology,Computer Software: Programming Data Processing
DJTWW,Trump Media & Technology Group Corp. Warrants,$16.64,-0.11,-0.657%,2940297701.00,United States,2021,56433,Technology,Computer Software: Programming Data Processing
DK,Delek US Holdings Inc. Common Stock,$20.68,0.40,1.972%,1334658765.00,United States,2017,1594764,Energy,Integrated oil Companies
DKL,Delek Logistics Partners L.P. Common Units representing Limited Partner Interests,$38.93,-1.22,-3.039%,1838661992.00,United States,2012,394714,Energy,Natural Gas Distribution
DKNG,DraftKings Inc. Class A Common Stock,$30.34,-0.20,-0.655%,14730992488.00,United States,2019,8535083,Consumer Discretionary,Services-Misc. Amusement & Recreation
DKS,Dick's Sporting Goods Inc Common Stock,$207.13,6.55,3.266%,16879055805.00,United States,2002,749660,Consumer Discretionary,Other Specialty Stores
DLB,Dolby Laboratories Common Stock,$67.58,-0.38,-0.559%,6443592362.00,United States,2005,806028,Miscellaneous,Multi-Sector Companies
DLHC,DLH Holdings Corp.,$9.91,-0.03,-0.302%,140552450.00,United States,,44031,Consumer Discretionary,Professional Services
DLNG,Dynagas LNG Partners LP Common Units,$3.65,-0.08,-2.145%,134457871.00,Greece,,8402,Consumer Discretionary,Marine Transportation
DLNG^A,Dynagas LNG Partners LP 9.00% Series A Cumulative Redeemable Preferred Units,$25.30,0.0599,0.237%,,Greece,,931,,
DLNG^B,Dynagas LNG Partners LP 8.75% Series B Fixed to Floating Rate Cumulative Redeemable Perpetual Preferred Units liquidation preference $25.00 per Uni,$26.5729,0.3329,1.269%,,Greece,,7859,,
DLO,DLocal Limited Class A Common Shares,$7.59,-0.25,-3.189%,2246576737.00,Uruguay,2021,3462771,Consumer Discretionary,Business Services
DLPN,Dolphin Entertainment Inc. Common Stock,$0.79,0.01,1.282%,14974380.00,United States,,10868,Consumer Discretionary,Other Consumer Services
DLR,Digital Realty Trust Inc. Common Stock,$150.12,0.46,0.307%,49150946226.00,United States,2004,803426,Real Estate,Real Estate Investment Trusts
DLR^J,Digital Realty Trust Inc. 5.250% Series J Cumulative Redeemable Preferred Stock,$22.37,0.20,0.902%,,United States,,36138,,
DLR^K,Digital Realty Trust Inc. 5.850% Series K Cumulative Redeemable Preferred Stock par value $0.01 per share,$24.95,0.12,0.483%,,United States,,10653,,
DLR^L,Digital Realty Trust Inc. 5.200% Series L Cumulative Redeemable Preferred Stock,$22.18,0.12,0.544%,,United States,,23588,,
DLTH,Duluth Holdings Inc. Class B Common Stock,$3.37,-0.08,-2.319%,118170708.00,United States,2015,124316,Consumer Discretionary,Clothing/Shoe/Accessory Stores
DLTR,Dollar Tree Inc. Common Stock,$95.05,0.12,0.126%,20430427200.00,United States,1995,1886171,Consumer Discretionary,Department/Specialty Retail Stores
DLX,Deluxe Corporation Common Stock,$19.09,-0.15,-0.78%,843990624.00,United States,,213521,Consumer Discretionary,Publishing
DLY,DoubleLine Yield Opportunities Fund Common Shares of Beneficial Interest,$16.20,0.05,0.31%,776721620.00,United States,2020,138307,Finance,Investment Managers
DM,Desktop Metal Inc. Class A Common Stock,$4.22,-0.16,-3.653%,140245817.00,United States,2019,619255,Technology,Industrial Machinery/Components
DMA,Destra Multi-Alternative Fund Common Stock,$8.06,-0.08,-0.983%,0.00,,2022,16132,Finance,Trusts Except Educational Religious and Charitable
DMAC,DiaMedica Therapeutics Inc. Common Stock,$3.55,0.20,5.97%,151754804.00,United States,2018,49032,Health Care,Biotechnology: Pharmaceutical Preparations
DMB,BNY Mellon Municipal Bond Infrastructure Fund Inc. Common Stock,$10.81,0.03,0.278%,0.00,,2013,36051,Finance,Trusts Except Educational Religious and Charitable
DMF,BNY Mellon Municipal Income Inc. Common Stock,$7.24,-0.02,-0.275%,450985783.00,United States,1988,42660,Finance,Finance/Investors Services
DMLP,Dorchester Minerals L.P. Common Units Representing Limited Partnership Interests,$30.33,-0.19,-0.623%,1215887602.00,United States,,36296,Energy,Oil & Gas Production
DMO,Western Asset Mortgage Opportunity Fund Inc. Common Stock,$12.13,-0.0062,-0.051%,0.00,United States,2010,48233,Finance,Trusts Except Educational Religious and Charitable
DMRC,Digimarc Corporation Common Stock,$28.47,-0.71,-2.433%,608498506.00,United States,,52373,Technology,EDP Services
DMYY,dMY Squared Technology Group Inc. Class A Common Stock,$10.74,0.04,0.374%,0.00,,2022,1964,Finance,Blank Checks
DNA,Ginkgo Bioworks Holdings Inc. Class A Common Stock,$0.2702,-0.0156,-5.458%,597487307.00,United States,2021,47160777,Health Care,Biotechnology: Biological Products (No Diagnostic Substances)
DNB,Dun & Bradstreet Holdings Inc. Common Stock,$11.88,-0.02,-0.168%,5248419284.00,United States,2020,3130425,Finance,Finance: Consumer Services
DNLI,Denali Therapeutics Inc. Common Stock,$22.39,0.11,0.494%,3205470261.00,United States,2017,625676,Health Care,Biotechnology: Biological Products (No Diagnostic Substances)
DNMR,Danimer Scientific Inc. Common Stock,$0.4068,-0.0552,-11.948%,47364009.00,United States,2020,966235,Industrials,Major Chemicals
DNN,Denison Mines Corp Ordinary Shares (Canada),$1.48,-0.06,-3.896%,1320542234.00,Canada,,13486644,Basic Materials,Other Metals and Minerals
DNOW,DNOW Inc. Common Stock,$12.82,0.00,0.00%,1364945336.00,United States,2014,991721,Industrials,Metal Fabrications
DNP,DNP Select Income Fund Inc. Common Stock,$8.95,0.03,0.336%,0.00,United States,1987,525496,Finance,Investment Managers
DNTH,Dianthus Therapeutics Inc. Common Stock,$27.50,0.76,2.842%,807110398.00,United States,2018,145393,Health Care,Biotechnology: Pharmaceutical Preparations
DNUT,Krispy Kreme Inc. Common Stock,$10.58,0.14,1.341%,1784846000.00,United States,2021,1988058,Consumer Staples,Food Chains
DO,Diamond Offshore Drilling Inc. Common Stock,$14.63,-0.22,-1.481%,1510006995.00,United States,2022,850610,Energy,Oil & Gas Production
DOC,Healthpeak Properties Inc. Common Stock,$21.63,0.22,1.028%,15125673285.00,United States,,2728170,Real Estate,Real Estate Investment Trusts
DOCN,DigitalOcean Holdings Inc. Common Stock,$32.57,3.47,11.924%,2966844423.00,United States,2021,5162371,Technology,Computer Software: Programming Data Processing
DOCS,Doximity Inc. Class A Common Stock,$35.60,9.94,38.737%,6601160367.00,United States,2021,11795062,Technology,EDP Services
DOCU,DocuSign Inc. Common Stock,$52.52,0.42,0.806%,10751702912.00,United States,1989,1120363,Technology,Computer Software: Prepackaged Software
DOGZ,Dogness (International) Corporation Class A Common Stock,$12.90,-0.51,-3.803%,137020743.00,China,2017,19508,Consumer Discretionary,Miscellaneous manufacturing industries
DOLE,Dole plc Ordinary Shares,$14.55,-0.14,-0.953%,1381219554.00,Ireland,2021,573673,Consumer Staples,Farming/Seeds/Milling
DOMA,Doma Holdings Inc. Common Stock,$6.01,0.00,0.00%,84213592.00,United States,2021,10623,Finance,Specialty Insurers
DOMH,Dominari Holdings Inc. Common Stock,$1.58,0.04,2.597%,9377169.00,United States,,1465,Health Care,Biotechnology: Pharmaceutical Preparations
DOMO,Domo Inc. Class B Common Stock,$7.28,-0.32,-4.211%,277911838.00,United States,2018,310896,Technology,Computer Software: Prepackaged Software
DOOO,BRP Inc. (Recreational Products) Common Subordinate Voting Shares,$66.29,-1.11,-1.647%,4968864330.00,Canada,,44722,Consumer Discretionary,Industrial Specialties
DORM,Dorman Products Inc. Common Stock,$105.48,-0.26,-0.246%,3224764833.00,United States,,136284,Consumer Discretionary,Auto Parts:O.E.M.
DOUG,Douglas Elliman Inc. Common Stock,$1.86,0.01,0.541%,170040804.00,United States,2021,670894,Finance,Real Estate
DOV,Dover Corporation Common Stock,$176.23,-0.33,-0.187%,24224156196.00,United States,,635695,Industrials,Industrial Machinery/Components
DOW,Dow Inc. Common Stock ,$52.66,-0.01,-0.019%,36910501334.00,United States,2019,2592718,Industrials,Major Chemicals
DOX,Amdocs Limited Ordinary Shares,$83.02,-0.93,-1.108%,9742215933.00,Guernsey,,776806,Technology,EDP Services
DOYU,DouYu International Holdings Limited ADS,$17.14,0.21,1.24%,542233738.00,China,2019,189070,Technology,Computer Software: Programming Data Processing
DPCS,DP Cap Acquisition Corp I Class A Ordinary Shares,$11.34,0.00,0.00%,0.00,United States,2021,2,Finance,Blank Checks
DPCSW,DP Cap Acquisition Corp I Warrants,$0.04,0.00,0.00%,0.00,United States,2021,750,Finance,Blank Checks
DPG,Duff & Phelps Utility and Infrastructure Fund Inc.,$10.52,0.08,0.766%,0.00,United States,2011,124525,Finance,Trusts Except Educational Religious and Charitable
DPRO,Draganfly Inc. Common Shares,$0.10,-0.0569,-36.265%,6339322.00,Canada,,7074340,Industrials,Aerospace
DPZ,Domino's Pizza Inc Common Stock,$438.40,0.79,0.181%,15332235974.00,United States,2004,442633,Consumer Discretionary,Food Distributors
DQ,DAQO New Energy Corp. American Depositary Shares each representing five ordinary shares,$16.86,-0.03,-0.178%,1112885624.00,China,2010,383606,Technology,Semiconductors
DRCT,Direct Digital Holdings Inc. Class A Common Stock,$3.23,-0.18,-5.279%,46093473.00,United States,2022,75013,Consumer Discretionary,Advertising
DRD,DRDGOLD Limited American Depositary Shares,$9.16,0.06,0.659%,791963258.00,South Africa,,114576,Basic Materials,Precious Metals
DRH,Diamondrock Hospitality Company Common Stock,$8.07,-0.01,-0.124%,1672568913.00,United States,2005,2468501,Real Estate,Real Estate Investment Trusts
DRH^A,Diamondrock Hospitality Company 8.250% Series A Cumulative Redeemable Preferred Stock,$25.29,-0.04,-0.158%,,United States,,8566,,
DRI,Darden Restaurants Inc. Common Stock,$143.10,-1.39,-0.962%,17009288145.00,United States,,954324,Consumer Discretionary,Restaurants
DRIO,DarioHealth Corp. Common Stock,$0.7905,-0.0444,-5.318%,23654329.00,Israel,,143779,Health Care,Medical/Dental Instruments
DRMA,Dermata Therapeutics Inc. Common Stock,$2.46,-0.16,-6.107%,3237313.00,United States,2021,227440,Health Care,Biotechnology: Pharmaceutical Preparations
DRMAW,Dermata Therapeutics Inc. Warrant,$0.0171,0.004,30.534%,22503.00,United States,2021,6290,Health Care,Biotechnology: Pharmaceutical Preparations
DRQ,Dril-Quip Inc. Common Stock,$14.26,-0.37,-2.529%,491288800.00,United States,1997,292387,Industrials,Metal Fabrications
DRRX,DURECT Corporation Common Stock,$1.43,-0.04,-2.721%,44386315.00,United States,2000,30038,Health Care,Biotechnology: Pharmaceutical Preparations
DRS,Leonardo DRS Inc. Common Stock,$27.60,0.06,0.218%,7278197473.00,Israel,,388745,Industrials,Industrial Machinery/Components
DRTS,Alpha Tau Medical Ltd. Ordinary Shares,$2.09,0.02,0.966%,145611579.00,Israel,,7395,Health Care,Medical/Dental Instruments
DRTSW,Alpha Tau Medical Ltd. Warrant,$0.23,-0.01,-4.167%,16024241.00,Israel,,15294,Health Care,Medical/Dental Instruments
DRUG,Bright Minds Biosciences Inc. Common Stock,$1.115,0.0349,3.231%,4977178.00,Canada,,9803,Health Care,Biotechnology: Pharmaceutical Preparations
DRVN,Driven Brands Holdings Inc. Common Stock,$13.52,0.43,3.285%,2218358693.00,United States,2021,521459,Consumer Discretionary,Automotive Aftermarket
DSGN,Design Therapeutics Inc. Common Stock,$4.24,0.18,4.433%,240071026.00,United States,2021,921323,Health Care,Biotechnology: Pharmaceutical Preparations
DSGR,Distribution Solutions Group Inc. Common Stock,$32.39,-0.35,-1.069%,1514470890.00,United States,,18981,Consumer Discretionary,Industrial Specialties
DSGX,Descartes Systems Group Inc. (The) Common Stock,$96.50,1.34,1.408%,8240148703.00,Canada,,99307,Technology,Computer Software: Prepackaged Software
DSL,DoubleLine Income Solutions Fund Common Shares of Beneficial Interests,$12.67,0.02,0.158%,1292299811.00,United States,2013,153992,Finance,Trusts Except Educational Religious and Charitable
DSM,BNY Mellon Strategic Municipal Bond Fund Inc. Common Stock,$6.06,0.04,0.664%,0.00,United States,1989,97767,Finance,Investment Managers
DSP,Viant Technology Inc. Class A Common Stock,$9.85,0.39,4.123%,625421721.00,United States,2021,152299,Technology,Computer Software: Programming Data Processing
DSS,DSS Inc. Common Stock,$1.467,-0.013,-0.878%,10366955.00,United States,,3544,Consumer Discretionary,Containers/Packaging
DSU,Blackrock Debt Strategies Fund Inc. Common Stock,$10.91,0.075,0.692%,0.00,United States,1998,92684,Finance,Finance Companies
DSWL,Deswell Industries Inc. Common Shares,$2.28,-0.02,-0.87%,36332345.00,Macau,1995,6731,Industrials,Plastic Products
DSX,Diana Shipping inc. common stock,$2.48,-0.01,-0.402%,297508034.00,Greece,2005,443758,Consumer Discretionary,Marine Transportation
DSX^B,Diana Shipping Inc. Perpetual Preferred Shares Series B (Marshall Islands),$25.97,-0.01,-0.038%,,Greece,,214,,
DSY,Big Tree Cloud Holdings Limited Ordinary Shares,$1.47,0.67,83.75%,83908403.00,China,,1841943,Consumer Discretionary,Containers/Packaging
DSYWW,Big Tree Cloud Holdings Limited Warrants,$0.0331,0.0015,4.747%,1889366.00,China,,19488,Consumer Discretionary,Containers/Packaging
DT,Dynatrace Inc. Common Stock,$47.71,0.41,0.867%,14213067779.00,United States,2019,3080635,Technology,Computer Software: Prepackaged Software
DTB,DTE Energy Company 2020 Series G 4.375% Junior Subordinated Debentures due 2080,$19.56,-0.10,-0.509%,4049312765.00,United States,2020,2588,Utilities,Electric Utilities: Central
DTC,Solo Brands Inc. Class A Common Stock,$1.32,0.14,11.864%,120951650.00,United States,2021,755708,Consumer Discretionary,Recreational Games/Products/Toys
DTCK,Davis Commodities Limited Ordinary Shares,$1.04,-0.06,-5.455%,25480650.00,Singapore,2023,100919,Industrials,Farming/Seeds/Milling
DTE,DTE Energy Company Common Stock,$119.91,0.02,0.017%,24823777793.00,United States,,634234,Utilities,Electric Utilities: Central
DTF,DTF Tax-Free Income 2028 Term Fund Inc. Common Stock,$11.18,-0.05,-0.445%,78590559.00,United States,1991,12560,Finance,Investment Managers
DTG,DTE Energy Company 2021 Series E 4.375% Junior Subordinated Debentures,$19.75,-0.12,-0.604%,4088646580.00,United States,2021,16397,Utilities,Electric Utilities: Central
DTI,Drilling Tools International Corporation Common Stock,$4.21,-0.09,-2.093%,125325671.00,United States,2021,33941,Industrials,Metal Fabrications
DTIL,Precision BioSciences Inc. Common Stock,$8.58,0.12,1.418%,62065661.00,United States,2019,11097,Health Care,Biotechnology: Biological Products (No Diagnostic Substances)
DTM,DT Midstream Inc. Common Stock ,$73.41,-0.79,-1.065%,7128968135.00,United States,2021,366051,Utilities,Natural Gas Distribution
DTSQU,DT Cloud Star Acquisition Corporation Units,$10.06,-0.01,-0.099%,0.00,United States,2024,2213,,
DTSS,Datasea Inc. Common Stock,$2.16,0.08,3.846%,6605159.00,China,,29001,Technology,Computer Software: Prepackaged Software
DTST,Data Storage Corporation Common Stock,$4.36,-0.10,-2.242%,30393311.00,United States,,45764,Technology,EDP Services
DTSTW,Data Storage Corporation Warrant,$0.78,0.04,5.405%,5437336.00,United States,,4483,Technology,EDP Services
DTW,DTE Energy Company 2017 Series E 5.25% Junior Subordinated Debentures due 2077,$23.32,-0.09,-0.384%,4827708266.00,United States,2017,22748,Utilities,Electric Utilities: Central
DUET,DUET Acquisition Corp. Class A Common Stock,$11.20,0.00,0.00%,0.00,Malaysia,2022,85,Finance,Blank Checks
DUK,Duke Energy Corporation (Holding Company) Common Stock,$112.67,0.24,0.213%,87003966215.00,United States,,2218657,Utilities,Power Generation
DUK^A,Duke Energy Corporation Depositary Shares each representing a 1/1000th interest in a share of 5.75% Series A Cumulative Redeemable Perpetual Preferred Stock,$25.23,-0.13,-0.513%,,United States,,34479,,
DUKB,Duke Energy Corporation 5.625% Junior Subordinated Debentures due 2078,$25.0775,-0.0625,-0.249%,19364888282.00,United States,2018,21014,Utilities,Power Generation
DUO,Fangdd Network Group Ltd. American Depositary Shares,$0.39,-0.0069,-1.738%,2344132.00,China,2019,43306,Finance,Real Estate
DUOL,Duolingo Inc. Class A Common Stock,$187.38,8.39,4.687%,8080222471.00,United States,2021,696095,Technology,Computer Software: Prepackaged Software
DUOT,Duos Technologies Group Inc. Common Stock,$2.67,0.08,3.089%,20110403.00,United States,,34585,Technology,Computer Software: Prepackaged Software
DV,DoubleVerify Holdings Inc. Common Stock,$18.79,-0.02,-0.106%,3195141999.00,United States,2021,1655632,Technology,Computer Software: Programming Data Processing
DVA,DaVita Inc. Common Stock,$140.30,1.42,1.022%,11771170000.00,United States,,581736,Health Care,Misc Health and Biotechnology Services
DVAX,Dynavax Technologies Corporation Common Stock,$11.10,0.40,3.738%,1454592651.00,United States,2004,2976585,Health Care,Biotechnology: Pharmaceutical Preparations
DVN,Devon Energy Corporation Common Stock,$44.92,-0.19,-0.421%,28128904000.00,United States,1985,6232649,Energy,Oil & Gas Production
DWSN,Dawson Geophysical Company Common Stock,$1.985,0.105,5.585%,61162473.00,United States,,319,Energy,Oil & Gas Production
DX,Dynex Capital Inc. Common Stock,$12.24,-0.04,-0.326%,914423178.00,United States,,957905,Real Estate,Real Estate Investment Trusts
DX^C,Dynex Capital Inc. 6.900% Series C Fixed-to-Floating Rate Cumulative Redeemable Preferred Stock,$24.75,-0.10,-0.402%,,United States,,4524,,
DXC,DXC Technology Company Common Stock ,$19.64,1.31,7.147%,3591579487.00,United States,,2590011,Technology,EDP Services
DXCM,DexCom Inc. Common Stock,$69.76,-1.74,-2.434%,27954703242.00,United States,2005,3932801,Health Care,Medical/Dental Instruments
DXF,Dunxin Financial Holdings Limited American Depositary Shares,$0.1395,0.0008,0.577%,3122677.00,China,,104469,Finance,Finance: Consumer Services
DXLG,Destination XL Group Inc. Common Stock,$2.98,-0.07,-2.295%,173519598.00,United States,,208583,Consumer Discretionary,Clothing/Shoe/Accessory Stores
DXPE,DXP Enterprises Inc. Common Stock,$47.75,-1.86,-3.749%,760576564.00,United States,,122925,Industrials,Industrial Machinery/Components
DXR,Daxor Corporation Common Stock,$8.80,-0.0999,-1.122%,36926402.00,United States,,1897,Health Care,Medical/Dental Instruments
DXYN,Dixie Group Inc. (The) Common Stock,$0.6279,0.0369,6.244%,9977241.00,United States,,42502,Consumer Discretionary,Home Furnishings
DXYZ,Destiny Tech100 Inc. Common Stock,$10.23,-0.05,-0.486%,0.00,,2024,94733,,
DY,Dycom Industries Inc. Common Stock,$183.27,-0.98,-0.532%,5331907832.00,United States,,195939,Industrials,Water Sewer Pipeline Comm & Power Line Construction
DYAI,Dyadic International Inc. Common Stock,$1.33,-0.06,-4.317%,38884963.00,United States,,10463,Health Care,Biotechnology: Biological Products (No Diagnostic Substances)
