Symbol,Name,Last Sale,Net Change,% Change,Market Cap,Country,IPO Year,Volume,Sector,Industry
JOF,Japan Smaller Capitalization Fund Inc Common Stock,$7.39,-0.02,-0.27%,0.00,United States,1990,59299,Finance,Trusts Except Educational Religious and Charitable
JOUT,Johnson Outdoors Inc. Class A Common Stock,$36.28,0.08,0.221%,373843342.00,United States,,26143,Consumer Discretionary,Recreational Games/Products/Toys
JPC,Nuveen Preferred & Income Opportunities Fund,$7.61,0.08,1.062%,0.00,United States,2003,779873,Finance,Investment Managers
JPI,Nuveen Preferred and Income Term Fund Common Shares of Beneficial Interest,$19.83,0.00,0.00%,451577069.00,,2012,137030,Finance,Finance Companies
JPM,JP Morgan Chase & Co. Common Stock,$205.80,1.74,0.853%,585534900817.00,United States,,5539129,Finance,Major Banks
JPM^C,J P Morgan Chase & Co Depositary Shares each representing a 1/400th interest in a share of 6.00% Non-Cumulative  Preferred Stock Series EE,$25.15,-0.01,-0.04%,,United States,,70960,,
JPM^D,J P Morgan Chase & Co Depositary Shares each representing a 1/400th  interest in a share of 5.75% Non-Cumulative  Preferred Stock Series DD,$25.04,-0.02,-0.08%,,United States,,79106,,
JPM^J,J P Morgan Chase & Co Depositary Shares each representing a 1/400th interest in a share of JPMorgan Chase & Co. 4.75% Non-Cumulative Preferred Stock Series GG,$21.87,-0.05,-0.228%,,United States,,22868,,
JPM^K,J P Morgan Chase & Co Depositary Shares each representing a 1/400th interest in a share of 4.55% Non-Cumulative Preferred Stock Series JJ,$21.03,-0.03,-0.142%,,United States,,62504,,
JPM^L,J P Morgan Chase & Co Depositary Shares each representing a 1/400th interest in a share of 4.625% Non-Cumulative Preferred Stock Series LL,$21.31,-0.01,-0.047%,,United States,,75082,,
JPM^M,J P Morgan Chase & Co Depositary Shares each representing a 1/400th interest in a share of 4.20% Non-Cumulative Preferred Stock Series MM,$19.6801,-0.0799,-0.404%,,United States,,72111,,
JQC,Nuveen Credit Strategies Income Fund Shares of Beneficial Interest,$5.64,0.03,0.535%,0.00,United States,2003,853930,Finance,Finance Companies
JRI,Nuveen Real Asset Income and Growth Fund Common Shares of Beneficial Interest,$12.62,0.10,0.799%,0.00,United States,2012,108120,Finance,Finance Companies
JRS,Nuveen Real Estate Income Fund Common Shares of Beneficial Interest,$8.31,0.07,0.85%,0.00,United States,2001,51968,Finance,Finance/Investors Services
JRSH,Jerash Holdings (US) Inc. Common Stock,$2.925,-0.055,-1.846%,35962407.00,United States,2018,3807,Consumer Discretionary,Apparel
JRVR,James River Group Holdings Ltd. Common Shares,$7.29,-0.07,-0.951%,275749841.00,Bermuda,2014,311921,Finance,Property-Casualty Insurers
JSM,Navient Corporation 6% Senior Notes due December 15 2043,$20.01,-0.13,-0.645%,2189295981.00,United States,,1682,Finance,Finance: Consumer Services
JSPR,Jasper Therapeutics Inc. Common Stock,$16.34,-0.08,-0.487%,246497936.00,United States,2020,81513,Health Care,Biotechnology: Biological Products (No Diagnostic Substances)
JSPRW,Japer Therapeutics Inc. Warrants,$0.21,0.00,0.00%,3167966.00,United States,2020,15,Health Care,Biotechnology: Biological Products (No Diagnostic Substances)
JTAI,Jet.AI Inc. Common Stock,$0.2601,0.0223,9.378%,3317613.00,Cayman Islands,2021,283163,Consumer Discretionary,Transportation Services
JTAIW,Jet.AI Inc. Warrant,$0.0702,-0.0001,-0.142%,895411.00,Cayman Islands,2021,75,Consumer Discretionary,Transportation Services
JTAIZ,Jet.AI Inc. Merger Consideration Warrants,$0.2101,0.00,0.00%,2679856.00,Cayman Islands,,645,Consumer Discretionary,Transportation Services
JUNE,Junee Limited Ordinary Shares,$4.59,0.05,1.101%,58358573.00,Hong Kong,2024,9107,,
JVA,Coffee Holding Co. Inc. Common Stock,$2.12,0.055,2.663%,12102230.00,United States,2005,16830,Consumer Staples,Packaged Foods
JVSA,JV SPAC Acquisition Corp. Class A Ordinary Share,$10.21,0.00,0.00%,0.00,China,2024,98,,
JVSAR,JV SPAC Acquisition Corp. Right,$0.33,0.00,0.00%,0.00,China,2024,4,,
JWEL,Jowell Global Ltd. Ordinary Shares,$1.23,-0.08,-6.107%,2669684.00,China,2021,305,Consumer Discretionary,Other Consumer Services
JWN,Nordstrom Inc. Common Stock,$22.25,0.06,0.27%,3641185355.00,United States,,1313053,Consumer Discretionary,Clothing/Shoe/Accessory Stores
JWSM,Jaws Mustang Acquisition Corp. Class A Ordinary Shares,$11.15,0.00,0.00%,0.00,,2021,126,Finance,Blank Checks
JXJT,JX Luxventure Limited Common Stock,$1.58,0.07,4.636%,9579843.00,China,2013,9723,Consumer Staples,Apparel
JXN,Jackson Financial Inc. Class A Common Stock ,$82.58,0.73,0.892%,6213403101.00,United States,2021,844476,Finance,Life Insurance
JXN^A,Jackson Financial Inc. Depositary Shares each representing a 1/1000th interest in a share of Fixed-Rate Reset Noncumulative Perpetual Preferred Stock Series A,$26.00,-0.02,-0.077%,,United States,,37347,,
JYD,Jayud Global Logistics Limited Class A Ordinary Shares,$0.55,0.05,10.00%,11743723.00,China,2023,5787,Consumer Discretionary,Oil Refining/Marketing
JYNT,The Joint Corp. Common Stock,$11.30,-1.03,-8.354%,169205183.00,United States,2014,67862,Miscellaneous,Multi-Sector Companies
JZ,Jianzhi Education Technology Group Company Limited American Depositary Shs,$0.82,0.01,1.235%,16551700.00,China,2022,3706,Real Estate,Other Consumer Services
JZXN,Jiuzi Holdings Inc. Ordinary Shares,$2.34,0.34,17.00%,21186355.00,China,2021,43447,Consumer Discretionary,Retail-Auto Dealers and Gas Stations
K,Kellanova Common Stock,$74.88,0.53,0.713%,25630510090.00,United States,,3867513,Consumer Staples,Packaged Foods
KA,Kineta Inc. Common Stock,$0.598,0.008,1.356%,7328164.00,United States,2016,26584,Health Care,Biotechnology: Pharmaceutical Preparations
KACL,Kairous Acquisition Corp. Limited Ordinary Shares,$12.10,0.05,0.415%,0.00,Malaysia,2022,5014,Finance,Blank Checks
KACLR,Kairous Acquisition Corp. Limited Rights,$0.1001,-0.0249,-19.92%,0.00,Malaysia,2022,101113,Finance,Blank Checks
KACLW,Kairous Acquisition Corp. Limited Warrants,$0.0061,0.00,0.00%,0.00,Malaysia,2022,5600,Finance,Blank Checks
KAI,Kadant Inc Common Stock,$294.66,-5.57,-1.855%,3460653228.00,United States,1992,57903,Industrials,Industrial Machinery/Components
KALA,KALA BIO Inc. Common Stock,$5.85,0.10,1.739%,26954279.00,United States,2017,16454,Health Care,Biotechnology: Pharmaceutical Preparations
KALU,Kaiser Aluminum Corporation Common Stock,$68.06,0.36,0.532%,1094888843.00,United States,,95831,Industrials,Metal Fabrications
KALV,KalVista Pharmaceuticals Inc. Common Stock,$12.90,-0.15,-1.149%,551289846.00,United Kingdom,2015,133892,Health Care,Biotechnology: Pharmaceutical Preparations
KAR,OPENLANE Inc. Common Stock,$17.00,0.45,2.719%,1841134187.00,United States,2009,772166,Consumer Discretionary,Retail-Auto Dealers and Gas Stations
KARO,Karooooo Ltd. Ordinary Shares,$35.25,-0.67,-1.865%,1089225000.00,Singapore,2021,4491,Technology,Computer Software: Prepackaged Software
KAVL,Kaival Brands Innovations Group Inc. Common Stock,$0.7611,0.1419,22.917%,2179031.00,United States,,321271,Consumer Discretionary,Other Consumer Services
KB,KB Financial Group Inc,$60.37,-0.14,-0.231%,22859935115.00,South Korea,,89543,Finance,Commercial Banks
KBDC,Kayne Anderson BDC Inc. Common Stock,$15.98,0.28,1.783%,0.00,,2024,47020,,
KBH,KB Home Common Stock,$80.17,0.46,0.577%,6029086161.00,United States,1986,869872,Consumer Discretionary,Homebuilding
KBR,KBR Inc. Common Stock,$64.27,0.46,0.721%,8551135069.00,United States,2006,499455,Industrials,Military/Government/Technical
KC,Kingsoft Cloud Holdings Limited American Depositary Shares,$2.43,-0.04,-1.619%,616456137.00,China,2020,272758,Technology,Computer Software: Prepackaged Software
KCGI,Kensington Capital Acquisition Corp. V Class A Ordinary Shares,$11.17,-0.02,-0.179%,0.00,,2021,274,Finance,Blank Checks
KD,Kyndryl Holdings Inc. Common Stock,$22.64,0.51,2.305%,5234537438.00,United States,2021,1538467,Technology,EDP Services
KDLY,Kindly MD Inc. Common Stock,$1.58,0.07,4.636%,9384435.00,United States,2024,21561,Health Care,Medical/Nursing Services
KDLYW,Kindly MD Inc. Warrants,$0.3374,-0.0025,-0.736%,2003993.00,United States,2024,1030,Health Care,Medical/Nursing Services
KDP,Keurig Dr Pepper Inc. Common Stock,$34.56,0.03,0.087%,46866345189.00,United States,,4352832,Consumer Staples,Beverages (Production/Distribution)
KE,Kimball Electronics Inc. Common Stock,$20.35,-0.15,-0.732%,506088342.00,United States,,138805,Technology,Electrical Products
KELYA,Kelly Services Inc. Class A Common Stock,$19.43,0.06,0.31%,690187000.00,United States,,294047,Consumer Discretionary,Professional Services
KELYB,Kelly Services Inc. Class B Common Stock,$20.78,0.00,0.00%,738141321.00,United States,,24,Consumer Discretionary,Professional Services
KEN,Kenon Holdings Ltd. Ordinary Shares,$24.62,0.34,1.40%,1299095104.00,Singapore,2015,30165,Utilities,Electric Utilities: Central
KEP,Korea Electric Power Corporation Common Stock,$7.10,-0.13,-1.798%,9115889893.00,South Korea,1994,124312,Utilities,Electric Utilities: Central
KEQU,Kewaunee Scientific Corporation Common Stock,$45.52,-1.38,-2.942%,129283309.00,United States,,12920,Industrials,Medical Specialities
KEX,Kirby Corporation Common Stock,$116.67,1.37,1.188%,6801861000.00,United States,,597994,Consumer Discretionary,Marine Transportation
KEY,KeyCorp Common Stock,$14.61,0.07,0.481%,13780089659.00,United States,,15510402,Finance,Major Banks
KEY^I,KeyCorp Depositary Shares Each Representing a 1/40th Ownership Interest in a Share of Fixed-to-Floating Rate Perpetual Non-Cumulative Preferred Stock Series E,$23.34,-0.18,-0.765%,,United States,,34528,,
KEY^J,KeyCorp Depositary Shares each representing a 1/40th ownership interest in a share of Fixed Rate Perpetual Non-Cumulative Preferred Stock Series F,$21.42,-0.315,-1.449%,,United States,,58725,,
KEY^K,KeyCorp Depositary Shares each representing a 1/40th ownership interest in a share of Fixed Rate Perpetual Non-Cumulative Preferred Stock Series G,$21.14,-0.345,-1.606%,,United States,,21671,,
KEY^L,KeyCorp Depositary Shares each representing a 1/40th ownership interest in a share of Fixed Rate Perpetual Non-Cumulative Preferred Stock Series H,$22.79,-0.11,-0.48%,,United States,,21306,,
KEYS,Keysight Technologies Inc. Common Stock,$122.87,-0.25,-0.203%,21445636173.00,United States,2014,2048346,Industrials,Industrial Machinery/Components
KF,Korea Fund Inc. (The) New Common Stock,$24.01,0.36,1.522%,0.00,United States,,10707,Finance,Investment Managers
KFFB,Kentucky First Federal Bancorp Common Stock,$3.40,-0.02,-0.585%,27535631.00,United States,2005,2283,Finance,Savings Institutions
KFRC,Kforce Inc. Common Stock,$62.87,-0.46,-0.726%,1218357730.00,United States,1995,73616,Consumer Discretionary,Professional Services
KFS,Kingsway Financial Services Inc. Common Stock (DE),$7.80,-0.11,-1.391%,216925199.00,Canada,,26203,Finance,Property-Casualty Insurers
KFY,Korn Ferry Common Stock,$67.73,-0.44,-0.645%,3508955840.00,United States,1999,270401,Consumer Discretionary,Diversified Commercial Services
KGC,Kinross Gold Corporation Common Stock,$8.48,0.05,0.593%,10421920000.00,Canada,2001,12424867,Basic Materials,Precious Metals
KGEI,Kolibri Global Energy Inc. Common stock,$3.1001,-0.0349,-1.113%,110442882.00,United States,,851,Energy,Oil & Gas Production
KGS,Kodiak Gas Services Inc. Common Stock,$28.88,-0.13,-0.448%,2434414792.00,United States,2023,654076,Utilities,Natural Gas Distribution
KHC,The Kraft Heinz Company Common Stock,$35.27,0.06,0.17%,42644212697.00,United States,,5108958,Consumer Staples,Packaged Foods
KIDS,OrthoPediatrics Corp. Common Stock,$26.91,-1.37,-4.844%,651610204.00,United States,2017,123016,Health Care,Medical/Dental Instruments
KIM,Kimco Realty Corporation (HC) Common Stock,$21.84,0.05,0.229%,14722609705.00,United States,,1768312,Real Estate,Real Estate Investment Trusts
KIM^L,Kimco Realty Corporation Class L Depositary Shares each of which represents a one-one thousandth fractional interest in a share of 5.125% Class L Cumulative Redeemable Preferred Stock liquidation preference $25000.00 per share,$21.77,-0.12,-0.548%,,United States,,7017,,
KIM^M,Kimco Realty Corporation Class M Depositary Shares each of which represents a one-one thousandth fractional interest in a share of 5.25% Class M Cumulative Redeemable Preferred Stock liquidation preference $25000.00 per share,$22.41,-0.03,-0.134%,,United States,,8244,,
KIM^N,Kimco Realty Corporation Depositary Shares each representing 1/1000th interest in a share of 7.25% Class N Cumulative Convertible Perpetual Preferred Stock,$57.25,0.10,0.175%,,United States,,2070,,
KIND,Nextdoor Holdings Inc. Class A Common Stock,$2.47,-0.25,-9.191%,938373778.00,United States,,2995851,Technology,Computer Software: Programming Data Processing
KINS,Kingstone Companies Inc. Common Stock,$7.35,0.27,3.814%,80909065.00,United States,,55803,Finance,Property-Casualty Insurers
KIO,KKR Income Opportunities Fund Common Shares,$14.04,-0.05,-0.355%,0.00,United States,2013,56809,Finance,Investment Managers
KIRK,Kirkland's Inc. COMMONSTOCK,$1.48,-0.03,-1.987%,19297687.00,United States,2002,40309,Consumer Discretionary,Other Specialty Stores
KITT,Nauticus Robotics Inc. Common stock,$2.29,0.37,19.271%,6967728.00,United States,2021,24191759,Industrials,Industrial Machinery/Components
KITTW,Nauticus Robotics Inc. Warrant,$0.0239,0.0005,2.137%,72720.00,United States,2021,2667844,Industrials,Industrial Machinery/Components
KKR,KKR & Co. Inc. Common Stock,$113.87,1.09,0.966%,101048433173.00,United States,,2052289,Finance,Investment Managers
KKRS,KKR Group Finance Co. IX LLC 4.625% Subordinated Notes due 2061,$19.69,-0.01,-0.051%,17472939749.00,United States,2021,4647,,
KLAC,KLA Corporation Common Stock,$746.78,-5.51,-0.732%,100385917929.00,United States,1980,763464,Technology,Electronic Components
KLG,WK Kellogg Co Common Stock,$17.06,0.29,1.729%,1465478549.00,United States,2023,772012,Consumer Staples,Packaged Foods
KLIC,Kulicke and Soffa Industries Inc. Common Stock,$40.46,-0.40,-0.979%,2205445388.00,Singapore,,612936,Technology,Semiconductors
KLTR,Kaltura Inc. Common Stock,$1.19,-0.03,-2.459%,174824310.00,United States,2021,147788,Technology,Computer Software: Prepackaged Software
KLXE,KLX Energy Services Holdings Inc. Common Stock,$5.97,-0.11,-1.809%,100697441.00,United States,,80871,Energy,Oilfield Services/Equipment
KMB,Kimberly-Clark Corporation Common Stock,$140.32,-0.93,-0.658%,47260397197.00,United States,,1485200,Consumer Discretionary,Containers/Packaging
KMDA,Kamada Ltd. Ordinary Shares,$5.53,0.08,1.468%,247965200.00,Israel,2013,29721,Health Care,Biotechnology: Pharmaceutical Preparations
KMI,Kinder Morgan Inc. Common Stock,$21.02,-0.05,-0.237%,46653104167.00,United States,2011,13389126,Utilities,Natural Gas Distribution
KMPB,Kemper Corporation 5.875% Fixed-Rate Reset Junior Subordinated Debentures due 2062,$22.63,-0.02,-0.088%,1457976063.00,United States,2022,15018,Finance,Property-Casualty Insurers
KMPR,Kemper Corporation,$60.27,0.48,0.803%,3882996787.00,United States,,338943,Finance,Property-Casualty Insurers
KMT,Kennametal Inc. Common Stock,$24.68,-0.17,-0.684%,1941474659.00,United States,,612529,Industrials,Industrial Machinery/Components
KMX,CarMax Inc,$75.69,-0.14,-0.185%,11813615877.00,United States,,1487293,Consumer Discretionary,Retail-Auto Dealers and Gas Stations
KN,Knowles Corporation Common Stock,$17.07,-0.16,-0.929%,1509453721.00,United States,2014,429045,Consumer Staples,Consumer Electronics/Appliances
KNDI,Kandi Technologies Group Inc. Ordinary Shares,$1.75,0.03,1.744%,152876910.00,China,,56107,Consumer Discretionary,Auto Manufacturing
KNF,Knife Riv Holding Co. Common Stock,$73.29,0.67,0.923%,4149145149.00,United States,2023,290886,Industrials,Mining & Quarrying of Nonmetallic Minerals (No Fuels)
KNOP,KNOT Offshore Partners LP Common Units representing Limited Partner Interests,$6.94,-0.16,-2.254%,236272862.00,United Kingdom,2013,41215,Consumer Discretionary,Marine Transportation
KNSA,Kiniksa Pharmaceuticals International plc Class A Ordinary Shares,$25.17,0.40,1.615%,1793204231.00,United States,2018,288644,Health Care,Biotechnology: Pharmaceutical Preparations
KNSL,Kinsale Capital Group Inc. Common Stock,$466.66,-0.99,-0.212%,10866842157.00,United States,,94402,Finance,Property-Casualty Insurers
KNTK,Kinetik Holdings Inc. Class A Common Stock,$40.65,-0.74,-1.788%,6246200667.00,United States,2022,641541,Utilities,Natural Gas Distribution
KNW,Know Labs Inc. Common Stock,$0.2839,0.0059,2.122%,24276904.00,,2022,470021,Industrials,Industrial Machinery/Components
KNX,Knight-Swift Transportation Holdings Inc.,$51.14,-1.40,-2.665%,8277724960.00,United States,2017,1432367,Industrials,Trucking Freight/Courier Services
KO,Coca-Cola Company (The) Common Stock,$68.68,-0.05,-0.073%,296001744542.00,United States,,12073890,Consumer Staples,Beverages (Production/Distribution)
KOD,Kodiak Sciences Inc Common Stock,$2.44,-0.01,-0.408%,128185271.00,United States,2018,122239,Health Care,Biotechnology: Biological Products (No Diagnostic Substances)
KODK,Eastman Kodak Company Common New,$4.85,-0.09,-1.822%,388485000.00,United States,,881700,Consumer Discretionary,Industrial Machinery/Components
KOF,Coca Cola Femsa S.A.B. de C.V.  American Depositary Shares each representing 10 Units (each Unit consists of 3 Series B Shares and 5 Series L Shares),$88.09,1.54,1.779%,18506231378.00,Mexico,1993,139577,Consumer Staples,Beverages (Production/Distribution)
KOP,Koppers Holdings Inc. Common Stock,$34.95,-0.61,-1.715%,740946431.00,United States,2006,304872,Basic Materials,Forest Products
KOPN,Kopin Corporation Common Stock,$0.8518,-0.0082,-0.953%,100876970.00,United States,1992,282819,Technology,Semiconductors
KORE,KORE Group Holdings Inc. Common Stock,$3.12,-0.14,-4.294%,51914828.00,United States,,67359,Telecommunications,Telecommunications Equipment
KOS,Kosmos Energy Ltd. Common Shares (DE),$4.78,-0.02,-0.417%,2255283687.00,Bermuda,2011,8583627,Energy,Oil & Gas Production
KOSS,Koss Corporation Common Stock,$6.68,-0.54,-7.479%,61822031.00,United States,,211704,Consumer Staples,Consumer Electronics/Appliances
KPLT,Katapult Holdings Inc. Common Stock,$17.91,-0.91,-4.835%,73532102.00,United States,2019,26153,Consumer Discretionary,Diversified Commercial Services
KPLTW,Katapult Holdings Inc. Warrant,$0.0106,-0.0001,-0.935%,43520.00,United States,2019,10200,Consumer Discretionary,Diversified Commercial Services
KPRX,Kiora Pharmaceuticals Inc.  Common Stock,$3.35,0.09,2.761%,9951403.00,United States,,46062,Health Care,Biotechnology: Pharmaceutical Preparations
KPTI,Karyopharm Therapeutics Inc. Common Stock,$0.81,-0.0284,-3.387%,100993782.00,United States,2013,329815,Health Care,Biotechnology: Pharmaceutical Preparations
KR,Kroger Company (The) Common Stock,$53.92,-0.40,-0.736%,38918961500.00,United States,,2847370,Consumer Staples,Food Chains
KRC,Kilroy Realty Corporation Common Stock,$33.53,0.33,0.994%,3935926795.00,United States,1997,657258,Real Estate,Real Estate Investment Trusts
KREF,KKR Real Estate Finance Trust Inc. Common Stock,$10.85,-0.01,-0.092%,752265307.00,United States,2017,372015,Real Estate,Real Estate Investment Trusts
KREF^A,KKR Real Estate Finance Trust Inc. 6.50% Series A Cumulative Redeemable Preferred Stock,$20.79,0.89,4.472%,,United States,,67186,,
KRG,Kite Realty Group Trust Common Stock,$24.39,0.20,0.827%,5357644935.00,United States,2004,869460,Real Estate,Real Estate Investment Trusts
KRKR,36Kr Holdings Inc. American Depositary Shares,$0.2538,0.0038,1.52%,9899647.00,China,2019,33302,Consumer Discretionary,Business Services
KRMD,KORU Medical Systems Inc. Common Stock (DE),$2.54,0.06,2.419%,116472533.00,United States,,55648,Health Care,Medical/Dental Instruments
KRNT,Kornit Digital Ltd. Ordinary Shares,$16.94,-0.27,-1.569%,808370583.00,Israel,2015,177172,Industrials,Industrial Machinery/Components
KRNY,Kearny Financial Corp Common Stock,$6.11,-0.16,-2.552%,393710039.00,United States,2005,514816,Finance,Savings Institutions
KRO,Kronos Worldwide Inc Common Stock,$10.56,-0.02,-0.189%,1214783497.00,United States,,198772,Industrials,Major Chemicals
KRON,Kronos Bio Inc. Common Stock,$1.03,-0.08,-7.207%,61897241.00,United States,2020,80369,Health Care,Biotechnology: Pharmaceutical Preparations
KROS,Keros Therapeutics Inc. Common Stock,$45.38,0.97,2.184%,1702752762.00,United States,2020,156072,Health Care,Biotechnology: Pharmaceutical Preparations
KRP,Kimbell Royalty Partners Common Units Representing Limited Partner Interests,$15.96,-0.03,-0.188%,1524080585.00,United States,2017,545518,Energy,Oil & Gas Production
KRRO,Korro Bio Inc. Common Stock,$34.41,-1.58,-4.39%,319083483.00,United States,2019,118539,Health Care,Biotechnology: Pharmaceutical Preparations
KRT,Karat Packaging Inc. Common Stock,$23.84,-4.15,-14.827%,476204763.00,United States,2021,171022,Industrials,Plastic Products
KRUS,Kura Sushi USA Inc. Class A Common Stock,$57.66,-0.32,-0.552%,648383413.00,United States,2019,111958,Consumer Discretionary,Restaurants
KRYS,Krystal Biotech Inc. Common Stock,$182.17,1.80,0.998%,5233734992.00,United States,2017,144558,Health Care,Biotechnology: Biological Products (No Diagnostic Substances)
KSCP,Knightscope Inc. Class A Common Stock,$0.191,0.0035,1.867%,20436796.00,United States,2022,1156370,Telecommunications,Telecommunications Equipment
KSM,DWS Strategic Municipal Income Trust,$10.04,0.02,0.20%,0.00,United States,1989,10270,Finance,Trusts Except Educational Religious and Charitable
KSPI,Joint Stock Company Kaspi.kz American Depository Shares,$120.34,0.15,0.125%,22784389178.00,Kazakhstan,2024,151570,,
KSS,Kohl's Corporation Common Stock,$20.20,-0.10,-0.493%,2246353787.00,United States,1992,5751340,Consumer Discretionary,Department/Specialty Retail Stores
KT,KT Corporation Common Stock,$14.03,-0.17,-1.197%,6914360621.00,South Korea,,421310,Telecommunications,Telecommunications Equipment
KTB,Kontoor Brands Inc. Common Stock ,$70.91,-0.17,-0.239%,3948642425.00,United States,2019,352708,Consumer Discretionary,Apparel
KTCC,Key Tronic Corporation Common Stock,$3.87,-0.02,-0.514%,41648441.00,United States,1983,4054,Technology,Electrical Products
KTF,DWS Municipal Income Trust,$9.75,0.02,0.206%,385134146.00,United States,1988,93475,Finance,Finance Companies
KTH,Structures Products Cp 8% CorTS Issued by Peco Energy Cap Tr II Preferred Stock,$28.47,0.135,0.476%,0.00,United States,,2789,Finance,Finance: Consumer Services
KTN,Structured Products Corp 8.205% CorTS 8.205% Corporate Backed Trust Securities (CorTS),$26.3772,-0.0728,-0.275%,0.00,United States,,4307,Finance,Finance: Consumer Services
KTOS,Kratos Defense & Security Solutions Inc. Common Stock,$19.725,-0.025,-0.127%,2978461193.00,United States,,1019078,Industrials,Military/Government/Technical
KTRA,Kintara Therapeutics Inc. Common Stock,$0.1854,0.0117,6.736%,10253475.00,United States,,1831050,Health Care,Biotechnology: Pharmaceutical Preparations
KTTA,Pasithea Therapeutics Corp. Common Stock,$4.85,0.00,0.00%,5059753.00,United States,2021,9968,Health Care,Biotechnology: Pharmaceutical Preparations
KTTAW,Pasithea Therapeutics Corp. Warrant,$0.0199,0.0073,57.937%,20761.00,United States,2021,10231,Health Care,Biotechnology: Pharmaceutical Preparations
KUKE,Kuke Music Holding Limited American Depositary Shares each representing one Ordinary Share,$1.26,0.06,5.00%,41897171.00,,2021,7945,Real Estate,Other Consumer Services
KULR,KULR Technology Group Inc. Common Stock,$0.239,0.0019,0.801%,43659857.00,United States,,2033175,Technology,Electrical Products
KURA,Kura Oncology Inc. Common Stock,$18.97,-0.15,-0.785%,1445146361.00,United States,,1107395,Health Care,Biotechnology: Pharmaceutical Preparations
KVAC,Keen Vision Acquisition Corporation Ordinary Shares,$10.67,-0.01,-0.094%,0.00,United States,2023,16216,,
KVACU,Keen Vision Acquisition Corporation Units,$10.55,0.00,0.00%,0.00,United States,2023,3,,
KVACW,Keen Vision Acquisition Corporation Warrant,$0.05,0.00,0.00%,0.00,United States,2023,300,,
KVHI,KVH Industries Inc. Common Stock,$4.49,0.01,0.223%,88516246.00,United States,1996,27357,Technology,Radio And Television Broadcasting And Communications Equipment
KVUE,Kenvue Inc. Common Stock,$21.02,-0.23,-1.082%,40256817823.00,United States,2023,20636687,Consumer Discretionary,Specialty Chemicals
KVYO,Klaviyo Inc. Series A Common Stock,$31.09,0.31,1.007%,8290855673.00,United States,2023,3488493,Technology,Computer Software: Prepackaged Software
KW,Kennedy-Wilson Holdings Inc. Common Stock,$10.70,0.28,2.687%,1471551087.00,United States,,895807,Finance,Real Estate
KWE,KWESST Micro Systems Inc. Common Stock,$0.2448,0.0015,0.617%,2711586.00,Canada,,70818,Technology,Computer Software: Prepackaged Software
KWESW,KWESST Micro Systems Inc. Warrant,$0.0353,0.0003,0.857%,605700.00,Canada,,310,Technology,Computer Software: Prepackaged Software
KWR,Quaker Houghton Common Stock,$157.95,-2.80,-1.742%,2829224882.00,United States,,100907,Industrials,Major Chemicals
KXIN,Kaixin Holdings Ordinary Shares,$0.104,0.0057,5.799%,5179882.00,China,2017,1598374,Consumer Discretionary,Retail-Auto Dealers and Gas Stations
KYMR,Kymera Therapeutics Inc. Common Stock,$41.44,-0.57,-1.357%,2559054390.00,United States,2020,296299,Health Care,Biotechnology: Biological Products (No Diagnostic Substances)
KYN,Kayne Anderson Energy Infrastructure Fund Inc.,$10.32,-0.01,-0.097%,1404877390.00,United States,2004,309379,Finance,Finance/Investors Services
KYTX,Kyverna Therapeutics Inc. Common Stock,$6.56,-0.26,-3.812%,282836001.00,United States,2024,642337,Health Care,Biotechnology: Biological Products (No Diagnostic Substances)
KZIA,Kazia Therapeutics Limited American Depositary Shares,$0.43,0.038,9.694%,9805252.00,Australia,,1393349,Health Care,Biotechnology: Pharmaceutical Preparations
KZR,Kezar Life Sciences Inc. Common Stock,$0.5643,-0.0131,-2.269%,41081807.00,United States,2018,253919,Health Care,Biotechnology: Pharmaceutical Preparations
L,Loews Corporation Common Stock,$77.88,0.44,0.568%,17095945955.00,United States,,466473,Finance,Property-Casualty Insurers
