Symbol,Name,Last Sale,Net Change,% Change,Market Cap,Country,IPO Year,Volume,Sector,Industry
PRIF^J,Priority Income Fund Inc. 6.000% Series J Term Preferred Stock due 2028,$22.60,0.00,0.00%,,,,1,,
PRIF^K,Priority Income Fund Inc. 7.000% Series K Cumulative Preferred Stock,$20.35,-0.1403,-0.685%,,,,1071,,
PRIF^L,Priority Income Fund Inc. 6.375% Series L Term Preferred Stock Due 2029,$23.054,-0.116,-0.501%,,,,150,,
PRIM,Primoris Services Corporation Common Stock,$52.26,-0.41,-0.778%,2804937392.00,United States,,514641,Industrials,Water Sewer Pipeline Comm & Power Line Construction
PRK,Park National Corporation Common Stock,$159.00,-1.58,-0.984%,2568110760.00,United States,1994,34132,Finance,Major Banks
PRKS,United Parks & Resorts Inc. Common Stock,$47.34,0.33,0.702%,2958316602.00,United States,2013,1003505,Health Care,Biotechnology: Electromedical & Electrotherapeutic Apparatus
PRLB,Proto Labs Inc. Common stock,$28.32,-0.05,-0.176%,712180485.00,United States,2012,443473,Industrials,Metal Fabrications
PRLD,Prelude Therapeutics Incorporated Common Stock,$5.10,-0.34,-6.25%,280140792.00,United States,2020,78884,Health Care,Biotechnology: Pharmaceutical Preparations
PRLH,Pearl Holdings Acquisition Corp Class A Ordinary Shares,$10.95,0.00,0.00%,0.00,United States,2022,1200,Finance,Blank Checks
PRLHU,Pearl Holdings Acquisition Corp Unit,$12.10,0.22,1.852%,0.00,United States,2021,1120,Finance,Blank Checks
PRLHW,Pearl Holdings Acquisition Corp Warrant,$0.0356,-0.0265,-42.673%,0.00,United States,2022,3000,Finance,Blank Checks
PRM,Perimeter Solutions SA Ordinary Shares,$10.25,-0.16,-1.537%,1488517075.00,Luxembourg,2021,493730,Industrials,Major Chemicals
PRME,Prime Medicine Inc. Common Stock,$4.195,-0.195,-4.442%,503529261.00,United States,2022,700383,Health Care,Biotechnology: Biological Products (No Diagnostic Substances)
PRMW,Primo Water Corporation Common Stock,$21.55,0.15,0.701%,3447284669.00,Canada,,754907,Consumer Staples,Beverages (Production/Distribution)
PRO,PROS Holdings Inc. Common Stock,$18.85,-1.23,-6.125%,889838944.00,United States,2007,660958,Technology,EDP Services
PROC,Procaps Group S.A. Ordinary Shares,$2.00,-0.03,-1.478%,225648366.00,Luxembourg,,3605,Health Care,Biotechnology: Pharmaceutical Preparations
PROCW,Procaps Group S.A. Warrants,$0.023,0.00,0.00%,2594956.00,Luxembourg,,320,Health Care,Biotechnology: Pharmaceutical Preparations
PROF,Profound Medical Corp. Common Stock,$9.35,-0.27,-2.807%,228410206.00,Canada,,57484,Health Care,Medical/Dental Instruments
PROK,ProKidney Corp. Class A Ordinary Shares,$2.18,0.09,4.306%,505101725.00,United States,2021,277534,Health Care,Biotechnology: Biological Products (No Diagnostic Substances)
PROP,Prairie Operating Co. Common Stock,$9.29,1.20,14.833%,113245815.00,United States,,76920,Finance,Finance: Consumer Services
PROV,Provident Financial Holdings Inc. Common Stock,$13.21,-0.04,-0.302%,90857667.00,United States,,909,Finance,Savings Institutions
PRPH,ProPhase Labs Inc. Common Stock (DE),$2.53,-0.01,-0.394%,48268678.00,United States,,18547,Health Care,Biotechnology: Pharmaceutical Preparations
PRPL,Purple Innovation Inc. Common Stock,$1.04,0.01,0.971%,112016195.00,United States,2015,212838,Consumer Discretionary,Home Furnishings
PRPO,Precipio Inc.  Common Stock,$5.34,0.04,0.755%,7847344.00,United States,,7211,Industrials,Biotechnology: Laboratory Analytical Instruments
PRQR,ProQR Therapeutics N.V. Ordinary Shares,$2.00,-0.055,-2.676%,162709184.00,Netherlands,2014,118398,Health Care,Biotechnology: Pharmaceutical Preparations
PRS,Prudential Financial Inc. 5.625% Junior Subordinated Notes due 2058,$24.80,-0.10,-0.402%,8853600000.00,United States,2018,12436,Finance,Life Insurance
PRSO,Peraso Inc. Common Stock,$1.23,-0.07,-5.385%,3192026.00,United States,,28644,Technology,Semiconductors
PRT,PermRock Royalty Trust Trust Units,$3.98,0.07,1.79%,48419613.00,United States,2018,20938,Energy,Oil & Gas Production
PRTA,Prothena Corporation plc Ordinary Shares,$20.55,0.87,4.421%,1105011415.00,United States,,568744,Health Care,Biotechnology: Pharmaceutical Preparations
PRTC,PureTech Health plc American Depositary Shares,$21.35,0.35,1.667%,578188104.00,United States,,345,Health Care,Biotechnology: Pharmaceutical Preparations
PRTG,Portage Biotech Inc. Common Stock,$0.1493,-0.0127,-7.84%,2952889.00,Canada,,179536,Energy,Oil & Gas Production
PRTH,Priority Technology Holdings Inc. Common Stock,$5.15,0.09,1.779%,412335497.00,United States,2016,24047,Consumer Discretionary,Business Services
PRTS,CarParts.com Inc. Common Stock,$0.78,-0.048,-5.797%,44686188.00,United States,2007,1547131,Consumer Discretionary,Auto & Home Supply Stores
PRU,Prudential Financial Inc. Common Stock,$109.46,0.74,0.681%,39077220000.00,United States,2001,1150485,Finance,Life Insurance
PRVA,Privia Health Group Inc. Common Stock,$19.07,-0.28,-1.447%,2275390560.00,United States,2021,503317,Health Care,Medical/Nursing Services
PRZO,ParaZero Technologies Ltd. Ordinary Shares,$0.64,0.019,3.06%,6447332.00,Israel,2023,330573,Industrials,Military/Government/Technical
PSA,Public Storage Common Stock,$317.04,3.87,1.236%,55487841462.00,United States,,558197,Real Estate,Real Estate Investment Trusts
PSA^F,Public Storage Depositary Shares Each Representing 1/1000 of a 5.15% Cumulative Preferred Share of Beneficial Interest Series F par value $0.01 per share,$23.93,-0.04,-0.167%,,United States,,12026,,
PSA^G,Public Storage Depositary Shares Each Representing 1/1000 of a 5.05% Cumulative Preferred Share of Beneficial Interest Series G,$23.23,-0.04,-0.172%,,United States,,13421,,
PSA^H,Public Storage Depositary Shares Each Representing 1/1000 of a  5.60% Cumulative Preferred  Share of Beneficial Interest Series H,$25.17,-0.11,-0.435%,,United States,,8088,,
PSA^I,Public Storage Depositary Shares Each Representing 1/1000 of a 4.875% Cumulative Preferred Share of Beneficial Interest Series I par value $0.01 per share,$22.27,0.04,0.18%,,United States,,7363,,
PSA^J,Public Storage Depositary Shares Each Representing 1/1000 of a 4.700% Cumulative Preferred Share of Beneficial Interest Series J par value $0.01 per share,$21.49,-0.01,-0.047%,,United States,,8379,,
PSA^K,Public Storage Depositary Shares Each Representing 1/1000 of a 4.75% Cumulative Preferred Share of Beneficial Interest Series K,$21.50,-0.02,-0.093%,,United States,,4215,,
PSA^L,Public Storage Depositary Shares Each Representing 1/1000 of a 4.625% Cumulative Preferred Share of Beneficial Interest Series L par value $0.01 per share,$21.05,0.02,0.095%,,United States,,17751,,
PSA^M,Public Storage Depositary Shares Each Representing 1/1000 of a 4.125% Cumulative Preferred Share of Beneficial Interest Series M,$19.10,0.04,0.21%,,United States,,11244,,
PSA^N,Public Storage Depositary Shares Each Representing 1/1000 of a 3.875% Cumulative Preferred Share of Beneficial Interest Series N,$17.7618,-0.1282,-0.717%,,United States,,8303,,
PSA^O,Public Storage Depositary Shares Each Representing 1/1000 of a 3.900% Cumulative Preferred Share of Beneficial Interest Series O,$17.72,-0.01,-0.056%,,United States,,8248,,
PSA^P,Public Storage Depositary Shares Each Representing 1/1000 of a 4.000% Cumulative Preferred Share of Bene cial Interest Series P,$18.23,-0.16,-0.87%,,United States,,20381,,
PSA^Q,Public Storage Depositary Shares Each Representing 1/1000 of a 3.950% Cumulative Preferred Share of Beneficial Interest Series Q par value $0.01 per share,$18.00,-0.13,-0.717%,,United States,,2113,,
PSA^R,Public Storage Depositary Shares Each Representing 1/1000 of a 4.00% Cumulative Preferred Share of Bene cial Interest Series R,$18.29,-0.10,-0.544%,,United States,,12499,,
PSA^S,Public Storage Depositary Shares Each Representing 1/1000 of a 4.100% Cumulative Preferred Share of Beneficial Interest Series S,$18.667,0.077,0.414%,,United States,,14168,,
PSBD,Palmer Square Capital BDC Inc. Common Stock,$16.27,-0.02,-0.123%,0.00,,2024,13896,,
PSEC,Prospect Capital Corporation Common Stock,$4.75,-0.16,-3.259%,1984349023.00,United States,2004,7341230,Finance,Finance: Consumer Services
PSEC^A,Prospect Capital Corporation 5.35% Series A Fixed Rate Cumulative Perpetual Preferred Stock,$16.33,-0.38,-2.274%,,United States,,18957,,
PSF,Cohen & Steers Select Preferred and Income Fund Inc. Common Stock,$19.95,0.05,0.251%,980315629.00,,2010,25530,Finance,Investment Managers
PSFE,Paysafe Limited Common Shares,$19.57,0.08,0.41%,1207849500.00,,2021,228447,Consumer Discretionary,Business Services
PSHG,Performance Shipping Inc. Common Shares,$1.96,0.01,0.513%,24068165.00,Greece,,42619,Consumer Discretionary,Marine Transportation
PSIG,PS International Group Ltd. Ordinary Shares,$1.01,0.32,46.377%,24525766.00,Hong Kong,,2268702,Consumer Discretionary,Oil Refining/Marketing
PSMT,PriceSmart Inc. Common Stock,$82.69,0.62,0.755%,2533538331.00,United States,,100984,Consumer Discretionary,Department/Specialty Retail Stores
PSN,Parsons Corporation Common Stock,$92.82,1.17,1.277%,9856103952.00,United States,2019,846645,Technology,EDP Services
PSNL,Personalis Inc. Common Stock,$3.26,-0.17,-4.956%,173023515.00,United States,2019,714460,Health Care,Medical Specialities
PSNY,Polestar Automotive Holding UK PLC Class A ADS,$0.6675,-0.018,-2.626%,1408386285.00,Sweden,,19194584,Consumer Discretionary,Auto Manufacturing
PSNYW,Polestar Automotive Holding UK PLC Class C-1 ADS (ADW),$0.1309,0.0058,4.636%,276191408.00,Sweden,,27325,Consumer Discretionary,Auto Manufacturing
PSO,Pearson Plc Common Stock,$13.27,-0.11,-0.822%,8858962428.00,United Kingdom,,336764,Consumer Discretionary,Books
PSQH,PSQ Holdings Inc. Class A Common Stock,$2.69,0.04,1.509%,84443391.00,,2021,71145,Consumer Discretionary,Advertising
PSTG,Pure Storage Inc. Class A Common Stock,$56.68,1.44,2.607%,18434289079.00,United States,2015,2247891,Technology,Electronic Components
PSTL,Postal Realty Trust Inc. Class A Common Stock,$14.28,-0.07,-0.488%,328915895.00,United States,2019,71011,Real Estate,Real Estate Investment Trusts
PSTV,PLUS THERAPEUTICS Inc. Common Stock ,$1.45,-0.10,-6.452%,8271118.00,United States,,74726,Health Care,Medical/Dental Instruments
PSTX,Poseida Therapeutics Inc. Common Stock,$2.83,-0.20,-6.601%,274850095.00,United States,2020,400385,Health Care,Biotechnology: Biological Products (No Diagnostic Substances)
PSX,Phillips 66 Common Stock,$135.41,-0.01,-0.007%,56678453070.00,United States,,2056632,Energy,Integrated oil Companies
PT,Pintec Technology Holdings Limited American Depositary Shares,$1.03,0.00,0.00%,16426400.00,China,2018,1042,Technology,Computer Software: Programming Data Processing
PTA,Cohen & Steers Tax-Advantaged Preferred Securities and Income Fund Common Shares of Beneficial Interest,$19.98,0.04,0.201%,1104363671.00,United States,2020,49659,Finance,Trusts Except Educational Religious and Charitable
PTC,PTC Inc. Common Stock,$173.15,2.73,1.602%,20801415248.00,United States,,737869,Technology,Computer Software: Prepackaged Software
PTCT,PTC Therapeutics Inc. Common Stock,$31.29,-1.16,-3.575%,2399842403.00,United States,2013,725888,Health Care,Biotechnology: Pharmaceutical Preparations
PTEN,Patterson-UTI Energy Inc. Common Stock,$8.97,0.10,1.127%,3525656751.00,United States,1993,8747281,Energy,Oil & Gas Production
PTGX,Protagonist Therapeutics Inc. Common Stock,$38.72,1.54,4.142%,2280785531.00,United States,2016,1063482,Health Care,Biotechnology: Pharmaceutical Preparations
PTIX,Protagenic Therapeutics Inc. Common Stock,$0.63,-0.0205,-3.151%,2794133.00,United States,,462,Health Care,Biotechnology: Pharmaceutical Preparations
PTLO,Portillo's Inc. Class A Common Stock,$10.71,0.42,4.082%,661820402.00,United States,2021,1929594,Consumer Discretionary,Restaurants
PTMN,Portman Ridge Finance Corporation Common Stock,$18.65,-0.46,-2.407%,173559231.00,United States,2006,77729,Finance,Finance: Consumer Services
PTN,Palatin Technologies Inc. Common Stock,$1.36,-0.09,-6.207%,21945830.00,United States,1999,209663,Health Care,Biotechnology: Pharmaceutical Preparations
PTON,Peloton Interactive Inc. Class A Common Stock,$2.99,0.01,0.336%,1108734936.00,United States,2019,14126155,Consumer Discretionary,Recreational Games/Products/Toys
PTPI,Petros Pharmaceuticals Inc. Common Stock,$0.3179,-0.006,-1.852%,2225362.00,United States,,186830,Health Care,Biotechnology: Pharmaceutical Preparations
PTSI,P.A.M. Transportation Services Inc. Common Stock,$17.48,-0.61,-3.372%,380277592.00,United States,1986,15828,Industrials,Trucking Freight/Courier Services
PTVE,Pactiv Evergreen Inc. Common stock,$9.69,-0.35,-3.486%,1736977433.00,United States,2020,238768,Consumer Discretionary,Containers/Packaging
PTWO,Pono Capital Two Inc. Class A Common Stock,$13.90,0.00,0.00%,0.00,United States,2022,17,Finance,Blank Checks
PTWOW,Pono Capital Two Inc. Warrants,$0.078,0.003,4.00%,0.00,United States,2022,500,Finance,Blank Checks
PTY,Pimco Corporate & Income Opportunity Fund,$14.32,-0.01,-0.07%,0.00,United States,2002,541356,Finance,Investment Managers
PUBM,PubMatic Inc. Class A Common Stock,$14.06,-5.54,-28.265%,702030015.00,United States,2020,4043247,Technology,Computer Software: Programming Data Processing
PUK,Prudential Public Limited Company Common Stock,$16.25,0.03,0.185%,22221316065.00,United Kingdom,,1041717,Finance,Life Insurance
PULM,Pulmatrix Inc. Common Stock,$2.2781,0.0781,3.55%,8320270.00,United States,2014,18083,Health Care,Biotechnology: Pharmaceutical Preparations
PUMP,ProPetro Holding Corp. Common Stock,$8.26,0.01,0.121%,860379582.00,United States,2017,922721,Energy,Oilfield Services/Equipment
PVBC,Provident Bancorp Inc. (MD) Common Stock,$9.93,-0.19,-1.877%,175328171.00,United States,2015,15334,Finance,Banks
PVH,PVH Corp. Common Stock,$96.39,-0.60,-0.619%,5384132089.00,United States,,481894,Consumer Discretionary,Apparel
PVL,Permianville Royalty Trust Trust Units ,$1.65,-0.08,-4.624%,54450000.00,United States,2011,292572,Energy,Oil & Gas Production
PW,Power REIT (MD) Common Stock,$1.45,-0.68,-31.925%,4915008.00,United States,1998,497071,Real Estate,Real Estate Investment Trusts
PW^A,Power REIT 7.75% Series A Cumulative Perpetual Preferred Stock,$3.77,-0.02,-0.528%,,United States,,821,,
PWM,Prestige Wealth Inc. Class A Ordinary Shares,$0.6982,-0.0101,-1.426%,6388530.00,Hong Kong,2023,5918,Finance,Finance: Consumer Services
PWOD,Penns Woods Bancorp Inc. Common Stock,$21.68,-0.08,-0.368%,163240622.00,United States,,11997,Finance,Major Banks
PWP,Perella Weinberg Partners Class A Common Stock,$17.74,0.62,3.621%,1522787727.00,United States,2020,500945,Finance,Finance: Consumer Services
PWR,Quanta Services Inc. Common Stock,$259.62,-3.18,-1.21%,38249757224.00,United States,,802301,Industrials,Engineering & Construction
PWSC,PowerSchool Holdings Inc. Class A Common Stock,$22.57,-0.01,-0.044%,4596432005.00,United States,2021,719144,Technology,Computer Software: Prepackaged Software
PWUP,PowerUp Acquisition Corp. Class A Ordinary Shares,$11.34,0.00,0.00%,0.00,United States,2022,333,Finance,Blank Checks
PWUPU,PowerUp Acquisition Corp. Unit,$11.11,0.00,0.00%,0.00,United States,2022,150,Finance,Blank Checks
PWUPW,PowerUp Acquisition Corp. Warrant,$0.061,-0.0189,-23.655%,0.00,United States,2022,6950,Finance,Blank Checks
PX,P10 Inc. Class A Common Stock,$9.30,0.52,5.923%,1051110134.00,United States,2021,526642,Finance,Investment Managers
PXDT,Pixie Dust Technologies Inc. American Depositary Shares ,$1.16,-0.06,-4.918%,17054630.00,Japan,2023,5627,Health Care,Biotechnology: Electromedical & Electrotherapeutic Apparatus
PXLW,Pixelworks Inc.  Common Stock,$0.8396,-0.0106,-1.247%,48535012.00,United States,2000,311714,Technology,Semiconductors
PXS,Pyxis Tankers Inc. Common Stock,$4.88,0.11,2.306%,51447629.00,Greece,,18533,Consumer Discretionary,Marine Transportation
PXSAP,Pyxis Tankers Inc. 7.75% Series A Cumulative Convertible Preferred Shares,$24.85,0.06,0.242%,261982293.00,Greece,,844,Consumer Discretionary,Marine Transportation
PXSAW,Pyxis Tankers Inc. Warrant,$0.99,0.00,0.00%,10437122.00,Greece,,2,Consumer Discretionary,Marine Transportation
PYCR,Paycor HCM Inc. Common Stock,$12.27,0.04,0.327%,2186638320.00,United States,2021,668880,Technology,Computer Software: Prepackaged Software
PYN,PIMCO New York Municipal Income Fund III Common Shares of Beneficial Interest,$6.04,0.025,0.416%,0.00,United States,2002,5536,Finance,Investment Managers
PYPD,PolyPid Ltd. Ordinary Shares,$3.26,-0.24,-6.857%,5390602.00,Israel,2020,221,Health Care,Medical/Dental Instruments
PYPL,PayPal Holdings Inc. Common Stock,$64.72,0.44,0.685%,66165417195.00,United States,,8602752,Consumer Discretionary,Business Services
PYT,PPlus Tr GSC-2 Tr Ctf Fltg Rate,$23.25,0.23,0.999%,0.00,United States,,2023,Finance,Finance: Consumer Services
PYXS,Pyxis Oncology Inc. Common Stock,$3.29,-0.19,-5.46%,193743076.00,United States,2021,425073,Health Care,Biotechnology: Pharmaceutical Preparations
PZC,PIMCO California Municipal Income Fund III Common Shares of Beneficial Interest,$7.30,-0.02,-0.273%,0.00,United States,2002,64459,Finance,Investment Managers
PZG,Paramount Gold Nevada Corp. Common Stock,$0.4112,-0.0035,-0.844%,26164003.00,United States,2015,31007,Basic Materials,Metal Mining
PZZA,Papa John's International Inc. Common Stock,$44.86,1.63,3.771%,1479138500.00,United States,1993,1476642,Consumer Discretionary,Restaurants
QBTS,D-Wave Quantum Inc. Common Shares,$0.8421,0.0421,5.263%,144226441.00,,2022,1837239,Technology,EDP Services
QCOM,QUALCOMM Incorporated Common Stock,$164.48,-0.47,-0.285%,183230720000.00,United States,1991,4819570,Technology,Radio And Television Broadcasting And Communications Equipment
QCRH,QCR Holdings Inc. Common Stock,$70.11,-0.34,-0.483%,1178288221.00,United States,,49513,Finance,Major Banks
QD,Qudian Inc. American Depositary Shares each representing one Class A Ordinary Share,$1.65,-0.04,-2.367%,312516354.00,China,2017,180628,Finance,Finance: Consumer Services
QDEL,QuidelOrtho Corporation Common Stock,$41.62,0.22,0.531%,2798337098.00,United States,,931348,Health Care,Biotechnology: In Vitro & In Vivo Diagnostic Substances
QETA,Quetta Acquisition Corporation Common Stock,$10.40,0.00,0.00%,0.00,United States,2023,22,Finance,Blank Checks
QETAR,Quetta Acquisition Corporation Right,$1.10,-0.0001,-0.009%,0.00,United States,2023,5000,Finance,Blank Checks
QETAU,Quetta Acquisition Corporation Unit,$10.43,0.00,0.00%,0.00,United States,2023,24,Finance,Blank Checks
QFIN,Qifu Technology Inc. American Depositary Shares,$20.35,0.23,1.143%,3159428566.00,China,2018,1191006,Finance,Finance: Consumer Services
QGEN,Qiagen N.V. Common Shares,$45.42,-0.09,-0.198%,10364969132.00,Netherlands,,847455,Health Care,Biotechnology: Biological Products (No Diagnostic Substances)
QH,Quhuo Limited American Depository Shares,$0.3812,-0.0118,-3.003%,2351097.00,China,2020,38114,Consumer Discretionary,Business Services
QIPT,Quipt Home Medical Corp. Common Shares,$3.26,-0.05,-1.511%,138783165.00,United States,,72302,Health Care,Misc Health and Biotechnology Services
QLGN,Qualigen Therapeutics Inc. Common Stock,$0.2111,0.0017,0.812%,2029494.00,United States,2015,235796,Health Care,Biotechnology: Pharmaceutical Preparations
QLI,Qilian International Holding Group Ltd. Ordinary Shares,$5.41,-0.35,-6.076%,38681500.00,China,2021,331,Health Care,Biotechnology: Pharmaceutical Preparations
QLYS,Qualys Inc. Common Stock,$125.93,-1.20,-0.944%,4635611497.00,United States,2012,431561,Technology,Computer Software: Prepackaged Software
QMCO,Quantum Corporation Common Stock,$0.3201,0.0081,2.596%,30681565.00,United States,,68890,Technology,Electronic Components
QMMM,QMMM Holdings Limited Ordinary Shares,$4.02,0.00,0.00%,68842500.00,Hong Kong,2024,188205,Consumer Discretionary,Advertising
QNCX,Quince Therapeutics Inc. Common Stock,$0.69,0.00,0.00%,29818511.00,United States,2019,31070,Health Care,Biotechnology: Biological Products (No Diagnostic Substances)
QNRX,Quoin Pharmaceuticals Ltd. American Depositary Shares,$0.4956,-0.0286,-5.456%,1972473.00,Israel,2016,107891,Health Care,Medical/Dental Instruments
QNST,QuinStreet Inc. Common Stock,$17.07,-1.50,-8.078%,943575027.00,United States,2010,989239,Consumer Discretionary,Business Services
QOMO,Qomolangma Acquisition Corp. Common Stock,$11.72,0.27,2.358%,0.00,United States,2022,2060,Finance,Blank Checks
QOMOU,Qomolangma Acquisition Corp. Unit,$11.30,0.00,0.00%,0.00,United States,2022,8,Finance,Blank Checks
QQQX,Nuveen NASDAQ 100 Dynamic Overwrite Fund Shares of Beneficial Interest,$23.83,0.23,0.975%,0.00,United States,,43088,Finance,Finance Companies
QRHC,Quest Resource Holding Corporation Common Stock,$7.63,-0.64,-7.739%,154353534.00,United States,,139782,Utilities,Environmental Services
QRTEA,Qurate Retail Inc. Series A Common Stock ,$0.6421,-0.0105,-1.609%,254823193.00,United States,,1479676,Consumer Discretionary,Catalog/Specialty Distribution
QRTEB,Qurate Retail Inc. Series B Common Stock ,$3.74,-0.05,-1.319%,1484252828.00,United States,,562,Consumer Discretionary,Catalog/Specialty Distribution
QRTEP,Qurate Retail Inc. 8.0% Fixed Rate Cumulative Redeemable Preferred Stock,$38.98,0.83,2.176%,15469565574.00,United States,,60451,Consumer Discretionary,Catalog/Specialty Distribution
QRVO,Qorvo Inc. Common Stock,$106.20,-0.88,-0.822%,10074274945.00,United States,,854451,Technology,Semiconductors
QS,QuantumScape Corporation Class A Common Stock,$5.68,-0.06,-1.045%,2874725095.00,United States,2020,4198535,Miscellaneous,Industrial Machinery/Components
QSG,QuantaSing Group Limited American Depositary Shares,$1.69,0.05,3.049%,93298397.00,China,2023,11966,Real Estate,Other Consumer Services
QSI,Quantum-Si Incorporated Class A Common Stock,$0.887,0.0395,4.661%,126274475.00,United States,2020,592066,Industrials,Industrial Machinery/Components
QSIAW,Quantum-Si Incorporated Warrant,$0.1241,-0.0259,-17.267%,17667038.00,United States,2020,11546,Industrials,Industrial Machinery/Components
QSR,Restaurant Brands International Inc. Common Shares,$70.51,-1.42,-1.974%,22308125774.00,Canada,2014,1652552,Consumer Discretionary,Restaurants
QTI,QT Imaging Holdings Inc. Common Stock,$0.509,0.034,7.158%,10913681.00,United States,,21064,Health Care,Biotechnology: Electromedical & Electrotherapeutic Apparatus
QTRX,Quanterix Corporation Common Stock,$10.92,-1.90,-14.821%,417909361.00,United States,2017,1575660,Industrials,Biotechnology: Laboratory Analytical Instruments
QTTB,Q32 Bio Inc. Common Stock,$34.43,-1.40,-3.907%,411167501.00,United States,2018,23740,Health Care,Biotechnology: Pharmaceutical Preparations
QTWO,Q2 Holdings Inc. Common Stock,$68.60,0.17,0.248%,4135425599.00,United States,2014,418205,Technology,Computer Software: Prepackaged Software
QUAD,Quad Graphics Inc Class A Common Stock,$4.49,-0.13,-2.814%,234203159.00,United States,,119109,Consumer Discretionary,Publishing
QUBT,Quantum Computing Inc. Common Stock,$0.5893,-0.0137,-2.272%,53837057.00,United States,,267869,Technology,Computer Software: Prepackaged Software
QUIK,QuickLogic Corporation Common Stock,$9.04,-0.08,-0.877%,130393168.00,United States,1999,154696,Technology,Semiconductors
QURE,uniQure N.V. Ordinary Shares,$7.15,-0.08,-1.107%,348187976.00,Netherlands,2014,400372,Health Care,Biotechnology: Pharmaceutical Preparations
QVCC,QVC Inc. 6.250% Senior Secured Notes due 2068,$12.08,0.03,0.249%,12.00,United States,2019,19255,Consumer Discretionary,Catalog/Specialty Distribution
QVCD,QVC Inc. 6.375% Senior Secured Notes due 2067,$12.18,0.19,1.585%,12.00,United States,2018,16933,Consumer Discretionary,Catalog/Specialty Distribution
QXO,QXO Inc. Common Stock,$11.16,0.01,0.09%,7415240.00,United States,,3445654,Technology,EDP Services
R,Ryder System Inc. Common Stock,$133.56,-0.14,-0.105%,5780901921.00,United States,,227014,Consumer Discretionary,Rental/Leasing Companies
RA,Brookfield Real Assets Income Fund Inc. Common Stock,$13.08,0.05,0.384%,0.00,United States,2016,389309,Finance,Investment Managers
RACE,Ferrari N.V. Common Shares,$420.11,-0.44,-0.105%,102402216646.00,Italy,2015,193336,Consumer Discretionary,Auto Manufacturing
RAIL,FreightCar America Inc. Common Stock,$3.38,0.13,4.00%,63241781.00,United States,2005,10481,Industrials,Railroads
RAMP,LiveRamp Holdings Inc. Common Stock,$21.74,-0.09,-0.412%,1448137184.00,United States,2018,1748772,Technology,EDP Services
RAND,Rand Capital Corporation Common Stock,$17.75,-0.05,-0.281%,45813123.00,United States,,1692,Finance,Finance: Consumer Services
RANI,Rani Therapeutics Holdings Inc. Class A Common Stock,$2.26,-0.15,-6.224%,120698708.00,United States,2021,26186,Health Care,Biotechnology: Pharmaceutical Preparations
RAPP,Rapport Therapeutics Inc. Common Stock,$19.06,0.50,2.694%,674275270.00,United States,2024,154502,Health Care,Biotechnology: Pharmaceutical Preparations
RAPT,RAPT Therapeutics Inc. Common Stock,$2.27,-0.09,-3.814%,79230891.00,United States,2019,175003,Health Care,Biotechnology: Pharmaceutical Preparations
RARE,Ultragenyx Pharmaceutical Inc. Common Stock,$50.03,-0.26,-0.517%,4611024456.00,United States,2014,516627,Health Care,Biotechnology: Pharmaceutical Preparations
RAVE,Rave Restaurant Group Inc. Common Stock,$1.785,-0.025,-1.381%,26037020.00,United States,,5069,Consumer Discretionary,Food Distributors
RAY,Raytech Holding Limited Ordinary Shares,$2.50,-0.31,-11.032%,44032708.00,Hong Kong,2024,30873,Consumer Discretionary,Consumer Electronics/Appliances
RAYA,Erayak Power Solution Group Inc. Class A Ordinary Shares,$0.823,-0.004,-0.484%,10246350.00,China,2022,1977,Consumer Discretionary,Metal Fabrications
RBA,RB Global Inc. Common Stock,$78.94,0.65,0.83%,14502674843.00,Canada,,814690,Consumer Discretionary,Business Services
RBB,RBB Bancorp Common Stock,$21.27,0.00,0.00%,392224628.00,United States,2017,54036,Finance,Major Banks
RBBN,Ribbon Communications Inc. Common Stock,$2.94,0.00,0.00%,513108192.00,United States,,176490,Technology,EDP Services
RBC,RBC Bearings Incorporated Common Stock,$277.42,-0.89,-0.32%,8108948593.00,United States,2022,86892,Industrials,Metal Fabrications
